Vincent Crabbe;Slytherin;Unknown;Cool. Umm..um.
Harry James Potter;Gryffindor;Stag;We'll just go.
Harry James Potter;Gryffindor;Stag;One, but it's not powerful enough for all of them.
Harry James Potter;Gryffindor;Stag;Let's go!
Harry James Potter;Gryffindor;Stag;Arania Exumai!
Harry James Potter;Gryffindor;Stag;Go!
Harry James Potter;Gryffindor;Stag;Arania Exumai!
Harry James Potter;Gryffindor;Stag;Don't mention it.
Harry James Potter;Gryffindor;Stag;Get us out of here.
Harry James Potter;Gryffindor;Stag;Now!
Harry James Potter;Gryffindor;Stag;Come on!
Harry James Potter;Gryffindor;Stag;Come on, move faster!
Harry James Potter;Gryffindor;Stag;Come on! Go!
Harry James Potter;Gryffindor;Stag;Get us in the air.
Harry James Potter;Gryffindor;Stag;Come on! Pull!
Harry James Potter;Gryffindor;Stag;We know one thing.
Harry James Potter;Gryffindor;Stag;Hagrid never opened the Chamber of Secrets.
Harry James Potter;Gryffindor;Stag;He was innocent.
Harry James Potter;Gryffindor;Stag;Wish you were here, Hermione.
Harry James Potter;Gryffindor;Stag;We need you.
Harry James Potter;Gryffindor;Stag;Now more than ever.
Harry James Potter;Gryffindor;Stag;Ron...
Harry James Potter;Gryffindor;Stag;This is why Hermione was in the library the day she was attacked.
Harry James Potter;Gryffindor;Stag;Come on.
Harry James Potter;Gryffindor;Stag;"Of the many fearsome beasts that roam our land none is more deadly than the basilisk.
"
Harry James Potter;Gryffindor;Stag;Capable of living for hundreds of years instant death awaits any who meet this giant serpent's eye.
Harry James Potter;Gryffindor;Stag;Spiders flee before it.
Harry James Potter;Gryffindor;Stag;Ron, this is it.
Harry James Potter;Gryffindor;Stag;The monster in the Chamber of Secrets is a basilisk.
Harry James Potter;Gryffindor;Stag;That's why I can hear it speak.
Harry James Potter;Gryffindor;Stag;It's a snake.
Harry James Potter;Gryffindor;Stag;Because no one did look it in the eye.
Harry James Potter;Gryffindor;Stag;Not directly, at least.
Harry James Potter;Gryffindor;Stag;Colin saw it through his camera.
Harry James Potter;Gryffindor;Stag;Justin... Justin must have seen the basilisk through Nearly Headless Nick.
Harry James Potter;Gryffindor;Stag;Nick got the full blast of it.
Harry James Potter;Gryffindor;Stag;But he's a ghost, he couldn't die again.
Harry James Potter;Gryffindor;Stag;And Hermione had the mirror.
Harry James Potter;Gryffindor;Stag;I bet you she was using it to look around corners in case it came along.
Harry James Potter;Gryffindor;Stag;The water.
Harry James Potter;Gryffindor;Stag;There was water on the floor that night.
Harry James Potter;Gryffindor;Stag;She only saw the basilisk's reflection.
Harry James Potter;Gryffindor;Stag;Spiders flee before it.
Harry James Potter;Gryffindor;Stag;It all fits.
Harry James Potter;Gryffindor;Stag;Hermione's answered that too.
Harry James Potter;Gryffindor;Stag;Remember what Aragog said about that girl 50 years ago?
Harry James Potter;Gryffindor;Stag;She died in a bathroom?
Harry James Potter;Gryffindor;Stag;What if she never left?
Harry James Potter;Gryffindor;Stag;Lockhart may be useless, but he's going to try and get into the Chamber.
Harry James Potter;Gryffindor;Stag;At least we can tell him what we know.
Harry James Potter;Gryffindor;Stag;Professor, we have some information for you.
Harry James Potter;Gryffindor;Stag;Are you going somewhere?
Harry James Potter;Gryffindor;Stag;You're running away?
Harry James Potter;Gryffindor;Stag;After all you did in your books?
Harry James Potter;Gryffindor;Stag;You wrote them.
Harry James Potter;Gryffindor;Stag;You're a fraud.
Harry James Potter;Gryffindor;Stag;You've been taking credit for what other wizards have done.
Harry James Potter;Gryffindor;Stag;Don't even think about it.
Harry James Potter;Gryffindor;Stag;To ask you how you died.
Harry James Potter;Gryffindor;Stag;Who was it, Myrtle?
Harry James Potter;Gryffindor;Stag;Just like that? How?
Harry James Potter;Gryffindor;Stag;This is it.
Harry James Potter;Gryffindor;Stag;This is it, Ron. I think this is the entrance to the Chamber of Secrets.
Harry James Potter;Gryffindor;Stag;Yes, there is.
Harry James Potter;Gryffindor;Stag;You first.
Harry James Potter;Gryffindor;Stag;All right. Let's go.
Harry James Potter;Gryffindor;Stag;Thanks, Myrtle.
Harry James Potter;Gryffindor;Stag;Now, remember: Any sign of movement, close your eyes straightaway.
Harry James Potter;Gryffindor;Stag;This way.
Harry James Potter;Gryffindor;Stag;It's a snake skin.
Harry James Potter;Gryffindor;Stag;Ron! Ron, are you okay?
Harry James Potter;Gryffindor;Stag;You wait here and try and shift some of this rock so we can get back through.
Harry James Potter;Gryffindor;Stag;I'll go on and find Ginny.
Harry James Potter;Gryffindor;Stag;Ginny! Ginny, please don't be dead.
Harry James Potter;Gryffindor;Stag;Wake up, wake up.
Harry James Potter;Gryffindor;Stag;Please wake up.
Harry James Potter;Gryffindor;Stag;Tom. Tom Riddle.
Harry James Potter;Gryffindor;Stag;What do you mean, she won't wake?
Harry James Potter;Gryffindor;Stag;She's not...?
Harry James Potter;Gryffindor;Stag;Are you a ghost?
Harry James Potter;Gryffindor;Stag;She's cold as ice.
Harry James Potter;Gryffindor;Stag;Ginny, please don't be dead. Wake up.
Harry James Potter;Gryffindor;Stag;You've got to help me, Tom.
Harry James Potter;Gryffindor;Stag;There's a basilisk.
Harry James Potter;Gryffindor;Stag;Give me my wand, Tom.
Harry James Potter;Gryffindor;Stag;We've got to go. We've got to save her.
Harry James Potter;Gryffindor;Stag;No. She couldn't. She wouldn't.
Harry James Potter;Gryffindor;Stag;But why?
Harry James Potter;Gryffindor;Stag;And why did you want to meet me?
Harry James Potter;Gryffindor;Stag;Hagrid's my friend.
Harry James Potter;Gryffindor;Stag;And you framed him, didn't you?
Harry James Potter;Gryffindor;Stag;I'll bet Dumbledore saw right through you.
Harry James Potter;Gryffindor;Stag;Well, you haven't finished it this time.
Harry James Potter;Gryffindor;Stag;In a few hours, the Mandrake Draught will be ready.
Harry James Potter;Gryffindor;Stag;And everyone who was Petrified will be all right again.
Harry James Potter;Gryffindor;Stag;Why do you care how I escaped?
Harry James Potter;Gryffindor;Stag;Voldemort was after your time.
Harry James Potter;Gryffindor;Stag;You. You're the Heir of Slytherin.
Harry James Potter;Gryffindor;Stag;You're Voldemort.
Harry James Potter;Gryffindor;Stag;Albus Dumbledore is the greatest sorcerer in the world.
Harry James Potter;Gryffindor;Stag;He'll never be gone.
Harry James Potter;Gryffindor;Stag;Not as long as those who remain are loyal to him.
Harry James Potter;Gryffindor;Stag;Fawkes?
Harry James Potter;Gryffindor;Stag;Ginny?
Harry James Potter;Gryffindor;Stag;Ginny?
Harry James Potter;Gryffindor;Stag;Don't worry.
Harry James Potter;Gryffindor;Stag;Ginny, you need to get yourself out.
Harry James Potter;Gryffindor;Stag;Follow the Chamber and you'll find Ron.
Harry James Potter;Gryffindor;Stag;You were brilliant, Fawkes.
Harry James Potter;Gryffindor;Stag;I just wasn't quick enough.
Harry James Potter;Gryffindor;Stag;Of course.
Harry James Potter;Gryffindor;Stag;Phoenix tears have healing powers.
Harry James Potter;Gryffindor;Stag;Thanks.
Harry James Potter;Gryffindor;Stag;It's all right, Ginny.
Harry James Potter;Gryffindor;Stag;It's over.
Harry James Potter;Gryffindor;Stag;It's just a memory.
Harry James Potter;Gryffindor;Stag;Yes, sir.
Harry James Potter;Gryffindor;Stag;Yes, sir.
Harry James Potter;Gryffindor;Stag;It's just...
Harry James Potter;Gryffindor;Stag;You see, sir, I couldn't help but notice certain things, certain...
Harry James Potter;Gryffindor;Stag;Certain similarities between Tom Riddle and me.
Harry James Potter;Gryffindor;Stag;Voldemort transferred some of his powers to me?
Harry James Potter;Gryffindor;Stag;So the Sorting Hat was right.
Harry James Potter;Gryffindor;Stag;I should be in Slytherin.
Harry James Potter;Gryffindor;Stag;Because I asked it to.
Harry James Potter;Gryffindor;Stag;Godric Gryffindor.
Harry James Potter;Gryffindor;Stag;Dobby.
Harry James Potter;Gryffindor;Stag;So this is your master.
Harry James Potter;Gryffindor;Stag;The family you serve is the Malfoys.
Harry James Potter;Gryffindor;Stag;Don't worry. I will be.
Harry James Potter;Gryffindor;Stag;Sir? I wonder if I could have that?
Harry James Potter;Gryffindor;Stag;Mr. Malfoy.
Harry James Potter;Gryffindor;Stag;Mr. Malfoy!
Harry James Potter;Gryffindor;Stag;I have something of yours.
Harry James Potter;Gryffindor;Stag;I think you do, sir.
Harry James Potter;Gryffindor;Stag;I think you slipped the diary into Ginny Weasley's cauldron that day at Diagon Alley.
Harry James Potter;Gryffindor;Stag;Open it.
Harry James Potter;Gryffindor;Stag;Just promise me something.
Harry James Potter;Gryffindor;Stag;Never try to save my life again.
Harry James Potter;Gryffindor;Stag;We had loads of help from you.
Harry James Potter;Gryffindor;Stag;We couldn't have done it without you.
Harry James Potter;Gryffindor;Stag;There's no Hogwarts without you, Hagrid.
Ginevra (Ginny) Molly Weasley;Gryffindor;Horse;Mum- Mummy, have you seen my jumper?
Ginevra (Ginny) Molly Weasley;Gryffindor;Horse;Leave him alone.
Ginevra (Ginny) Molly Weasley;Gryffindor;Horse;Harry, It was me.
Ginevra (Ginny) Molly Weasley;Gryffindor;Horse;But I swear, I didn't mean to.
Ginevra (Ginny) Molly Weasley;Gryffindor;Horse;Riddle made me, and...
Ginevra (Ginny) Molly Weasley;Gryffindor;Horse;Harry, you're hurt.
Gilderoy Lockhart;Ravenclaw;Non-corporeal;It can't be. Harry Potter?
Gilderoy Lockhart;Ravenclaw;Non-corporeal;Nice big smile, Harry.
Gilderoy Lockhart;Ravenclaw;Non-corporeal;Together, you and I rate the front page.
Gilderoy Lockhart;Ravenclaw;Non-corporeal;Ladies and gentlemen, what an extraordinary moment this is.
Gilderoy Lockhart;Ravenclaw;Non-corporeal;When young Harry stepped into Flourish and Blotts this morning to purchase my autobiography, Magical Me…
Gilderoy Lockhart;Ravenclaw;Non-corporeal;which, incidentally, is currently celebrating its 27th week atop the Daily Prophet bestseller list
Gilderoy Lockhart;Ravenclaw;Non-corporeal;he had no idea that he would, in fact, be leaving with my entire collected works free of charge.
Gilderoy Lockhart;Ravenclaw;Non-corporeal;Now, ladies?
Gilderoy Lockhart;Ravenclaw;Non-corporeal;Let me introduce you to your new Defense Against the Dark Arts Teacher.
Gilderoy Lockhart;Ravenclaw;Non-corporeal;Me. Gilderoy Lockhart, Order of Merlin, Third Class, Honorary Member of the Dark Force Defense League and five times winner of Witch Weekly's Most-Charming-Smile Award
Gilderoy Lockhart;Ravenclaw;Non-corporeal;But I don't talk about that.
Gilderoy Lockhart;Ravenclaw;Non-corporeal;I didn't get rid of the Bandon Banshee by smiling at her!
Gilderoy Lockhart;Ravenclaw;Non-corporeal;Now, be warned.
Gilderoy Lockhart;Ravenclaw;Non-corporeal;It is my job to arm you against the foulest creatures known to wizardkind.
Gilderoy Lockhart;Ravenclaw;Non-corporeal;You may find yourselves facing your worst fears in this room.
Gilderoy Lockhart;Ravenclaw;Non-corporeal;Know only that no harm can befall you whilst I am here.
Gilderoy Lockhart;Ravenclaw;Non-corporeal;I must ask you not to scream.
Gilderoy Lockhart;Ravenclaw;Non-corporeal;It might provoke them.
Gilderoy Lockhart;Ravenclaw;Non-corporeal;Freshly caught Cornish pixies.
Gilderoy Lockhart;Ravenclaw;Non-corporeal;Laugh if you will, Mr. Finnegan but pixies can be devilishly tricky little blighters.
Gilderoy Lockhart;Ravenclaw;Non-corporeal;Let's see what you make of them.
Gilderoy Lockhart;Ravenclaw;Non-corporeal;Come on now, round them up, round them up!
Gilderoy Lockhart;Ravenclaw;Non-corporeal;They're only pixies.
Gilderoy Lockhart;Ravenclaw;Non-corporeal;Peskipiksi Pesternomi!
Gilderoy Lockhart;Ravenclaw;Non-corporeal;I'll ask you three to just nip the rest of them back into their cage.
Gilderoy Lockhart;Ravenclaw;Non-corporeal;Harry, Harry, Harry.
Gilderoy Lockhart;Ravenclaw;Non-corporeal;Can you possibly imagine a better way to serve detention than by helping me to answer my fan mail?
Gilderoy Lockhart;Ravenclaw;Non-corporeal;Fame is a fickle friend, Harry.
Gilderoy Lockhart;Ravenclaw;Non-corporeal;Celebrity is as celebrity does.
Gilderoy Lockhart;Ravenclaw;Non-corporeal;Remember that.
Gilderoy Lockhart;Ravenclaw;Non-corporeal;Sorry?
Gilderoy Lockhart;Ravenclaw;Non-corporeal;Voice?
Gilderoy Lockhart;Ravenclaw;Non-corporeal;What are you talking about, Harry?
Gilderoy Lockhart;Ravenclaw;Non-corporeal;I think you're getting a bit drowsy.
Gilderoy Lockhart;Ravenclaw;Non-corporeal;And great Scott, no wonder.
Gilderoy Lockhart;Ravenclaw;Non-corporeal;Look at the time.
Gilderoy Lockhart;Ravenclaw;Non-corporeal;We've been here nearly four hours.
Gilderoy Lockhart;Ravenclaw;Non-corporeal;Spooky how the time flies when one is having fun.
Gilderoy Lockhart;Ravenclaw;Non-corporeal;Aghh! Thought so.
Gilderoy Lockhart;Ravenclaw;Non-corporeal;So unlucky I wasn't there.
Gilderoy Lockhart;Ravenclaw;Non-corporeal;I know exactly the countercurse that could've spared her.
Gilderoy Lockhart;Ravenclaw;Non-corporeal;I'm afraid that's my doing, Severus.
Gilderoy Lockhart;Ravenclaw;Non-corporeal;You see, Harry was helping me answer my fan mail.
Gilderoy Lockhart;Ravenclaw;Non-corporeal;Not to worry, Harry.
Gilderoy Lockhart;Ravenclaw;Non-corporeal;I will fix that arm of yours straight away.
Gilderoy Lockhart;Ravenclaw;Non-corporeal;Boy doesn't know what he's saying.
Gilderoy Lockhart;Ravenclaw;Non-corporeal;This won't hurt a bit.
Gilderoy Lockhart;Ravenclaw;Non-corporeal;Brackium Emendo!
Gilderoy Lockhart;Ravenclaw;Non-corporeal;Yes, well, that can sometimes happen but the point is you can no longer feel any pain, and, very clearly, the bones are not broken.
Gilderoy Lockhart;Ravenclaw;Non-corporeal;Much more flexible, though.
Gilderoy Lockhart;Ravenclaw;Non-corporeal;Gather round!
Gilderoy Lockhart;Ravenclaw;Non-corporeal;Gather round.
Gilderoy Lockhart;Ravenclaw;Non-corporeal;Can everybody see me?
Gilderoy Lockhart;Ravenclaw;Non-corporeal;Can you all hear me?
Gilderoy Lockhart;Ravenclaw;Non-corporeal;Excellent.
Gilderoy Lockhart;Ravenclaw;Non-corporeal;In light of the dark events of recent weeks Professor Dumbledore has granted me permission to start this Dueling Club to train you all up.
Gilderoy Lockhart;Ravenclaw;Non-corporeal;In case you ever need to defend yourselves as I myself have done on countless occasions.
Gilderoy Lockhart;Ravenclaw;Non-corporeal;For full details, see my published works.
Gilderoy Lockhart;Ravenclaw;Non-corporeal;Let me introduce my assistant Professor Snape.
Gilderoy Lockhart;Ravenclaw;Non-corporeal;He has sportingly agreed to help with a short demonstration.
Gilderoy Lockhart;Ravenclaw;Non-corporeal;I don't want any of you youngsters to worry.
Gilderoy Lockhart;Ravenclaw;Non-corporeal;You'll still have your Potions master when I'm through with him. Never fear.
Gilderoy Lockhart;Ravenclaw;Non-corporeal;One.Two. Three!
Gilderoy Lockhart;Ravenclaw;Non-corporeal;An excellent idea to show them that, Professor Snape...
Gilderoy Lockhart;Ravenclaw;Non-corporeal;but if you don't mind me saying, it was obvious what you were about to do.
Gilderoy Lockhart;Ravenclaw;Non-corporeal;If I had wanted to stop you, it would have been only too easy.
Gilderoy Lockhart;Ravenclaw;Non-corporeal;An excellent suggestion, Professor Snape..
Gilderoy Lockhart;Ravenclaw;Non-corporeal;Let's have a volunteer pair.
Gilderoy Lockhart;Ravenclaw;Non-corporeal;Potter, Weasley, how about you?
Gilderoy Lockhart;Ravenclaw;Non-corporeal;Good luck, Potter.
Gilderoy Lockhart;Ravenclaw;Non-corporeal;Wands at the ready.
Gilderoy Lockhart;Ravenclaw;Non-corporeal;On the count of three cast your charms to disarm your opponent. Only to disarm.
Gilderoy Lockhart;Ravenclaw;Non-corporeal;We don't want any accidents here.
Gilderoy Lockhart;Ravenclaw;Non-corporeal;One. Two...
Gilderoy Lockhart;Ravenclaw;Non-corporeal;I said disarm only.
Gilderoy Lockhart;Ravenclaw;Non-corporeal;Allow me, Professor Snape.
Gilderoy Lockhart;Ravenclaw;Non-corporeal;Alarte Ascendare!
Gilderoy Lockhart;Ravenclaw;Non-corporeal;So sorry. Dozed off.
Gilderoy Lockhart;Ravenclaw;Non-corporeal;What have I missed?
Gilderoy Lockhart;Ravenclaw;Non-corporeal;My moment?
Gilderoy Lockhart;Ravenclaw;Non-corporeal;Very well.
Gilderoy Lockhart;Ravenclaw;Non-corporeal;I'll just be in my office getting...
Gilderoy Lockhart;Ravenclaw;Non-corporeal;Getting ready.
Gilderoy Lockhart;Ravenclaw;Non-corporeal;Well, yes. Urgent call. Unavoidable.
Gilderoy Lockhart;Ravenclaw;Non-corporeal;Got to go.
Gilderoy Lockhart;Ravenclaw;Non-corporeal;Well… Aemm…
Gilderoy Lockhart;Ravenclaw;Non-corporeal;As to that, most unfortunate.
Gilderoy Lockhart;Ravenclaw;Non-corporeal;No one regrets more than I.
Gilderoy Lockhart;Ravenclaw;Non-corporeal;I must say, when I took the job, there was nothing in the description...
Gilderoy Lockhart;Ravenclaw;Non-corporeal;Books can be misleading.
Gilderoy Lockhart;Ravenclaw;Non-corporeal;My dear boy, use your common sense.
Gilderoy Lockhart;Ravenclaw;Non-corporeal;My books wouldn't have sold as well if people didn't think I'd done those things.
Gilderoy Lockhart;Ravenclaw;Non-corporeal;Yes, now you mention it.
Gilderoy Lockhart;Ravenclaw;Non-corporeal;I'm rather gifted with Memory Charms.
Gilderoy Lockhart;Ravenclaw;Non-corporeal;Otherwise, all those wizards would have gone blabbing.
Gilderoy Lockhart;Ravenclaw;Non-corporeal;I'd never have sold another book.
Gilderoy Lockhart;Ravenclaw;Non-corporeal;In fact, I'm going to have to do the same to you.
Gilderoy Lockhart;Ravenclaw;Non-corporeal;Excellent, Harry. Good work.
Gilderoy Lockhart;Ravenclaw;Non-corporeal;Well, then, I'll just be...
Gilderoy Lockhart;Ravenclaw;Non-corporeal;There's no need for me to stay.
Gilderoy Lockhart;Ravenclaw;Non-corporeal;Now, boys, what good will it do?
Gilderoy Lockhart;Ravenclaw;Non-corporeal;But... Obviously, yes.
Gilderoy Lockhart;Ravenclaw;Non-corporeal;Sure you don't want to test it first?
Gilderoy Lockhart;Ravenclaw;Non-corporeal;It's really quite filthy down here.
Gilderoy Lockhart;Ravenclaw;Non-corporeal;It looks like a snake.
Gilderoy Lockhart;Ravenclaw;Non-corporeal;The adventure ends here, boys.
Gilderoy Lockhart;Ravenclaw;Non-corporeal;But don't fret.
Gilderoy Lockhart;Ravenclaw;Non-corporeal;The world will know our story.
Gilderoy Lockhart;Ravenclaw;Non-corporeal;How I was too late to save the girl.
Gilderoy Lockhart;Ravenclaw;Non-corporeal;How you two tragically lost your minds at the sight of her mangled body.
Gilderoy Lockhart;Ravenclaw;Non-corporeal;So...You first, Mr. Potter.
Gilderoy Lockhart;Ravenclaw;Non-corporeal;Say goodbye to your memories.
Gilderoy Lockhart;Ravenclaw;Non-corporeal;Obliviate!
Gilderoy Lockhart;Ravenclaw;Non-corporeal;Hello. Who are you?
Gilderoy Lockhart;Ravenclaw;Non-corporeal;Really?
Gilderoy Lockhart;Ravenclaw;Non-corporeal;And who am I?
Gilderoy Lockhart;Ravenclaw;Non-corporeal;It's an odd sort of place, isn't it?
Gilderoy Lockhart;Ravenclaw;Non-corporeal;Do you live here?
Gilderoy Lockhart;Ravenclaw;Non-corporeal;Really?
Gilderoy Lockhart;Ravenclaw;Non-corporeal;Amazing!
Gilderoy Lockhart;Ravenclaw;Non-corporeal;This is just like magic!
George Weasley;Gryffindor;Unknown;Go, go, go, go!
George Weasley;Gryffindor;Unknown;Right!
George Weasley;Gryffindor;Unknown;Yeah, Mum would never know.
George Weasley;Gryffindor;Unknown;Morning, Dad.
George Weasley;Gryffindor;Unknown;Oh, it...
Fred Weasley;Gryffindor;Unknown;Come on.
Fred Weasley;Gryffindor;Unknown;Right.
Fred Weasley;Gryffindor;Unknown;Come on. Okay, come on. Shh!
Fred Weasley;Gryffindor;Unknown;Shh! Ok, come on. Shh! Come on.
Fred Weasley;Gryffindor;Unknown;Morning, Dad.
Fred Weasley;Gryffindor;Unknown;Oh, it...
Fred Weasley;Gryffindor;Unknown;This lot won’t come cheap, Mum.
Fred Weasley;Gryffindor;Unknown;The spell books alone are very expensive.
Fred Weasley;Gryffindor;Unknown;Not to mention they're dead scared that Harry will Petrify them if they fly anywhere near him.
Dudley Dursley;;;Who’d want to be friends with you?
Dudley Dursley;;;I’ll be waiting to open the door!
Dudley Dursley;;;Dad! What’s going on?
Dudley Dursley;;;Dad, hurry up!
Dudley Dursley;;;Aaah!
Dudley Dursley;;;Dad!
Draco Malfoy;Slytherin;Unknown;Can I have this?
Draco Malfoy;Slytherin;Unknown;" It's not my fault the teachers have favorites."
Draco Malfoy;Slytherin;Unknown;That Hermione Granger --
Draco Malfoy;Slytherin;Unknown;I'll bet you loved that, didn't you, Potter?
Draco Malfoy;Slytherin;Unknown;Famous Harry Potter.
Draco Malfoy;Slytherin;Unknown;Can't go into a bookshop without making the front page.
Draco Malfoy;Slytherin;Unknown;Look, Potter.
Draco Malfoy;Slytherin;Unknown;You've got yourself a girlfriend.
Draco Malfoy;Slytherin;Unknown;See you at school.
Draco Malfoy;Slytherin;Unknown;That's right.
Draco Malfoy;Slytherin;Unknown;And that's not all that's new this year.
Draco Malfoy;Slytherin;Unknown;You see, Weasley, unlike some, my father can afford the best.
Draco Malfoy;Slytherin;Unknown;No one asked your opinion, you filthy little Mudblood.
Draco Malfoy;Slytherin;Unknown;Enemies of the Heir, beware.
Draco Malfoy;Slytherin;Unknown;You'll be next, Mudbloods.
Draco Malfoy;Slytherin;Unknown;All right there, Scarhead?
Draco Malfoy;Slytherin;Unknown;Training for the ballet, Potter!!
Draco Malfoy;Slytherin;Unknown;You'll never catch me, Potter.
Draco Malfoy;Slytherin;Unknown;Scared, Potter?
Draco Malfoy;Slytherin;Unknown;Everte Statum!
Draco Malfoy;Slytherin;Unknown;Serpensortia!
Draco Malfoy;Slytherin;Unknown;Crabbe, Goyle, where have you been?
Draco Malfoy;Slytherin;Unknown;Pigging out in the Great Hall all this time?
Draco Malfoy;Slytherin;Unknown;Why are you wearing glasses?
Draco Malfoy;Slytherin;Unknown;Reading?
Draco Malfoy;Slytherin;Unknown;I didn't know you could read.
Draco Malfoy;Slytherin;Unknown;And what are you doing down here, Weasley?
Draco Malfoy;Slytherin;Unknown;Well, sit down.
Draco Malfoy;Slytherin;Unknown;You'd never know the Weasleys were pure-bloods, the way they behave.
Draco Malfoy;Slytherin;Unknown;They're an embarrassment to the wizarding world. All of them.
Draco Malfoy;Slytherin;Unknown;What's wrong with you, Crabbe?
Draco Malfoy;Slytherin;Unknown;I'm surprised the Daily Prophet hasn't done a report on all these attacks.
Draco Malfoy;Slytherin;Unknown;I suppose Dumbledore is trying to hush it all up.
Draco Malfoy;Slytherin;Unknown;Father always said Dumbledore was the worst thing that ever happened to this place.
Draco Malfoy;Slytherin;Unknown;What?
Draco Malfoy;Slytherin;Unknown;You think there's someone here who's worse than Dumbledore?
Draco Malfoy;Slytherin;Unknown;Well? Do you?
Draco Malfoy;Slytherin;Unknown;Good one, Goyle.
Draco Malfoy;Slytherin;Unknown;You're absolutely right.
Draco Malfoy;Slytherin;Unknown;Saint Potter.
Draco Malfoy;Slytherin;Unknown;And people actually think that he's the Heir of Slytherin?
Draco Malfoy;Slytherin;Unknown;You know I don't, Goyle.
Draco Malfoy;Slytherin;Unknown;I told you yesterday.
Draco Malfoy;Slytherin;Unknown;How many times do I have to tell you?
Draco Malfoy;Slytherin;Unknown;Is this yours?
Draco Malfoy;Slytherin;Unknown;But my father did say this:
Draco Malfoy;Slytherin;Unknown;It's been 50 years since the Chamber was opened.
Draco Malfoy;Slytherin;Unknown;He wouldn't tell me who opened it.
Draco Malfoy;Slytherin;Unknown;Only that they were expelled.
Draco Malfoy;Slytherin;Unknown;The last time the Chamber of Secrets was opened, a Mudblood died.
Draco Malfoy;Slytherin;Unknown;So it's only a matter of time before one of them is killed this time.
Draco Malfoy;Slytherin;Unknown;As for me I hope it's Granger.
Draco Malfoy;Slytherin;Unknown;What's the matter with you two?
Draco Malfoy;Slytherin;Unknown;You're acting very odd.
Draco Malfoy;Slytherin;Unknown;Hey! Where are you going?
Dobby;;;Ha- ha- ha! Ha, ha! Ho, ho, ho! Ha, ha!
Dobby;;;Harry Potter! Such an honor it is!
Dobby;;;Dobby sir, Dobby the house elf.
Dobby;;;Oh, oh yes, sir! Dobby understands!
Dobby;;;It’s just that, Dobby has come to tell you- it is difficult, sir
Dobby;;;" Dobby wonders where to begin?"
Dobby;;;S-sit down? S-sit- sit down?
Dobby;;;Oh, oh, ho. Oh, ho, ho... Oh, ho, ho.
Dobby;;;Offend Dobby?
Dobby;;;Dobby has heard of your greatness, sir, but never has he been asked to sit down by a wizard, like an equal.
Dobby;;;No, I haven’t.
Dobby;;;That was an awful thing to say.
Dobby;;;Bad Dobby!
Dobby;;;Bad Dobby!
Dobby;;;Baaad Dobby!
Dobby;;;Bad Dobby.
Dobby;;;Bad Dobby!
Dobby;;;Dobby had to punish himself, sir.
Dobby;;;Dobby almost spoke ill of his family, sir.
Dobby;;;The wizard family Dobby serves, sir.
Dobby;;;Dobby is bound to serve one family forever.
Dobby;;;If they ever knew Dobby was here...ooh...
Dobby;;;But Dobby had to come.
Dobby;;;Dobby has to protect Harry Potter- to warn him.
Dobby;;;Harry Potter must not go back to Hogwarts School of Witchcraft and Wizardry this year!
Dobby;;;There is a plot, a plot to make most terrible things happen.
Dobby;;;Ooo... er... can’t... say... argh...
Dobby;;;Don’t make me talk, I— Errr...
Dobby;;;Bad Dobby.
Dobby;;;Let me go!
Dobby;;;Friends who don’t even write to Harry Potter?
Dobby;;;Harry Potter mustn’t be angry with Dobby.
Dobby;;;Heh- Dobby hoped, if Harry Potter thought his friends had forgotten him, Harry Potter might not want to go back to school, sir.
Dobby;;;No! Ahh! Ooh...
Dobby;;;Harry Potter must say he’s not going back to school!
Dobby;;;Then, Dobby must do it, sir, for Harry Potter’s own good.
Dobby;;;Hello.
Dobby;;;Harry Potter should have listened to Dobby.
Dobby;;;Harry Potter should have gone back home when he missed the train.
Dobby;;;Indeed. Yes, sir.
Dobby;;;At least you would be away from here.
Dobby;;;Harry Potter must go home.
Dobby;;;Dobby thought his Bludger would be enough to make Harry Potter see...
Dobby;;;Dobby feels most aggrieved, sir.
